{
  "apiVersion": 1,
  "entry": "index.js",
  "allowedHosts": [],
  "id": "ROOM_073",
  "identity": {
    "name": "Archive of Missing Things",
    "nameRu": "Архив Исчезнувших Вещей",
    "symbol": "XX",
    "description": "Three stone pedestals stand in the basalt sanctuary, yet only two bear physical artifacts.",
    "descriptionRu": "Три каменных постамента стоят в базальтовом святилище, но лишь на двух покоятся видимые сосуды.",
    "dimension": "D3"
  },
  "audio": {
    "track": "audio/neuromicon_073.ogg",
    "loop": true,
    "baseHz": 108
  },
  "quest": {
    "question": "What remains when the physical form is absent, yet the space still remembers its weight?",
    "questionRu": "Что остаётся, когда физическая форма исчезла, но пространство всё ещё помнит её тяжесть?",
    "objective": "Align the Three-Ring Astrolabe or discover where the third pedestal still holds its vessel",
    "objectiveRu": "Совместите кольца Астролябии в центре зала или отыщите, где третий постамент всё ещё хранит свой сосуд",
    "completion": {
      "type": "interactReflection",
      "target": "obj_ghost"
    }
  },
  "doors": [
    {
      "id": "A",
      "symbol": "VI·⚖",
      "label": "Citadel of Unwritten Laws",
      "labelRu": "Цитадель Ненаписанных Законов",
      "destination": "ROOM_412",
      "requirement": null,
      "visibility": "visible",
      "choiceType": "identity-accept"
    },
    {
      "id": "B",
      "symbol": "X·☍",
      "label": "Abyssal Cartography",
      "labelRu": "Картография Бездны",
      "destination": "ROOM_891",
      "requirement": null,
      "visibility": "visible",
      "choiceType": "identity-reject"
    },
    {
      "id": "C",
      "symbol": "V·Φ",
      "label": "Sanctuary of the Golden Ratio",
      "labelRu": "Святилище Золотого Сечения",
      "destination": "ROOM_204",
      "requirement": null,
      "visibility": "visible",
      "choiceType": "free"
    },
    {
      "id": "RH",
      "symbol": "Ω",
      "label": "The Horizon beyond 1149",
      "labelRu": "Горизонт за Пределами 1149",
      "destination": "ROOM_1149",
      "requirement": {
        "type": "interactReflection",
        "target": "obj_ghost"
      },
      "visibility": "hidden",
      "choiceType": "rabbit-hole"
    }
  ],
  "mirror": {
    "characterState": "THE_ARCHIVIST",
    "characterStateRu": "АРХИВАРИУС НЕЗРИМОГО",
    "appearance": "assets/avatar_archivist.glb",
    "choices": ["accept", "reject", "back"]
  },
  "objects": [
    {
      "id": "obj_01",
      "title": "Basalt Reliquary Seal",
      "titleRu": "Базальтовая Печать-Реликварий",
      "type": "item",
      "model": "assets/key.glb",
      "interactions": ["inspect", "rotate"],
      "portable": false,
      "visibleInMirror": true
    },
    {
      "id": "puzzle_01",
      "title": "Three-Ring Harmonic Astrolabe",
      "titleRu": "Трёхкольцевая Гармоническая Астролябия",
      "type": "busyboard",
      "interactions": ["rotate", "align"],
      "portable": false,
      "visibleInMirror": true,
      "config": { "rings": 3 }
    },
    {
      "id": "obj_ghost",
      "title": "The Vessel of Absence",
      "titleRu": "Сосуд Отсутствия",
      "type": "anomaly",
      "interactions": ["interactReflection"],
      "portable": false,
      "visibleInMirror": true,
      "onlyInMirror": true
    }
  ],
  "radio": {
    "channel": "ROOM_073"
  }
}
